{
  "schema_version": "1.0",
  "checked_at": "2026-09-01T00:00:00Z",
  "policy": {
    "trust_order": ["S", "A", "B", "C", "R"],
    "single_source_claims": "One source may create a research lead, but it must not promote a current security claim beyond UNVERIFIED.",
    "restricted_source_rule": "Tier R sources are human-reference links only. SecHelix must not crawl them, copy their content, build embeddings or datasets from them, or use them for model training or evaluation without separate written permission."
  },
  "sources": [
    {
      "id": "mitre-cwe",
      "name": "Common Weakness Enumeration",
      "publisher": "MITRE",
      "independence_group": "mitre",
      "trust_tier": "S",
      "source_class": "CANONICAL_STANDARD",
      "domains": ["classification", "web", "api", "auth", "database", "cloud", "supply-chain", "crypto", "containers", "ai-security"],
      "canonical_url": "https://cwe.mitre.org/",
      "terms_url": "https://cwe.mitre.org/about/termsofuse.html",
      "access_mode": "BULK",
      "license": {
        "status": "VERIFIED",
        "expression": "LicenseRef-MITRE-CWE",
        "attribution_required": true,
        "per_artifact_review": false,
        "note": "MITRE grants research, development, and commercial use subject to retaining its copyright designation and license."
      },
      "allowed_uses": {
        "automated_retrieval": true,
        "normalized_facts": true,
        "full_text_storage": false,
        "embeddings": false,
        "model_training": false,
        "model_evaluation": false,
        "human_reference": true
      },
      "freshness": {"cadence": "QUARTERLY", "max_age_days": 95, "reviewed_at": "2026-09-01T00:00:00Z"}
    },
    {
      "id": "mitre-capec",
      "name": "Common Attack Pattern Enumeration and Classification",
      "publisher": "MITRE",
      "independence_group": "mitre",
      "trust_tier": "S",
      "source_class": "CANONICAL_STANDARD",
      "domains": ["classification", "web", "api", "auth", "cloud"],
      "canonical_url": "https://capec.mitre.org/",
      "terms_url": "https://capec.mitre.org/about/termsofuse.html",
      "access_mode": "BULK",
      "license": {
        "status": "VERIFIED",
        "expression": "LicenseRef-MITRE-CAPEC",
        "attribution_required": true,
        "per_artifact_review": false,
        "note": "MITRE grants research, development, and commercial use subject to retaining its copyright designation and license."
      },
      "allowed_uses": {
        "automated_retrieval": true,
        "normalized_facts": true,
        "full_text_storage": false,
        "embeddings": false,
        "model_training": false,
        "model_evaluation": false,
        "human_reference": true
      },
      "freshness": {"cadence": "QUARTERLY", "max_age_days": 95, "reviewed_at": "2026-09-01T00:00:00Z"}
    },
    {
      "id": "owasp-top-10",
      "name": "OWASP Top 10",
      "publisher": "OWASP Foundation",
      "independence_group": "owasp",
      "trust_tier": "S",
      "source_class": "CANONICAL_STANDARD",
      "domains": ["web", "classification"],
      "canonical_url": "https://owasp.org/www-project-top-ten/",
      "terms_url": "https://owasp.org/www-policy/operational/general-disclaimer.html",
      "access_mode": "WEB",
      "license": {
        "status": "PROJECT_SPECIFIC",
        "expression": "NOASSERTION",
        "attribution_required": true,
        "per_artifact_review": true,
        "note": "Verify the exact project release and repository license before copying or redistributing content."
      },
      "allowed_uses": {
        "automated_retrieval": false,
        "normalized_facts": true,
        "full_text_storage": false,
        "embeddings": false,
        "model_training": false,
        "model_evaluation": false,
        "human_reference": true
      },
      "freshness": {"cadence": "RELEASE", "max_age_days": 95, "reviewed_at": "2026-09-01T00:00:00Z"}
    },
    {
      "id": "owasp-api-top-10",
      "name": "OWASP API Security Top 10",
      "publisher": "OWASP Foundation",
      "independence_group": "owasp",
      "trust_tier": "S",
      "source_class": "CANONICAL_STANDARD",
      "domains": ["api", "classification"],
      "canonical_url": "https://owasp.org/API-Security/",
      "terms_url": "https://owasp.org/www-policy/operational/general-disclaimer.html",
      "access_mode": "WEB",
      "license": {
        "status": "PROJECT_SPECIFIC",
        "expression": "NOASSERTION",
        "attribution_required": true,
        "per_artifact_review": true,
        "note": "Verify the exact project release and repository license before copying or redistributing content."
      },
      "allowed_uses": {
        "automated_retrieval": false,
        "normalized_facts": true,
        "full_text_storage": false,
        "embeddings": false,
        "model_training": false,
        "model_evaluation": false,
        "human_reference": true
      },
      "freshness": {"cadence": "RELEASE", "max_age_days": 95, "reviewed_at": "2026-09-01T00:00:00Z"}
    },
    {
      "id": "owasp-asvs",
      "name": "OWASP Application Security Verification Standard 5",
      "publisher": "OWASP Foundation",
      "independence_group": "owasp",
      "trust_tier": "S",
      "source_class": "CANONICAL_STANDARD",
      "domains": ["web", "api", "auth", "database", "crypto", "classification"],
      "canonical_url": "https://github.com/OWASP/ASVS/tree/master/5.0",
      "terms_url": "https://github.com/OWASP/ASVS/blob/master/LICENSE.md",
      "access_mode": "REPOSITORY",
      "license": {
        "status": "VERIFIED",
        "expression": "CC-BY-SA-4.0",
        "attribution_required": true,
        "per_artifact_review": false,
        "note": "Use the versioned release, retain attribution, and mark adaptations."
      },
      "allowed_uses": {
        "automated_retrieval": true,
        "normalized_facts": true,
        "full_text_storage": false,
        "embeddings": false,
        "model_training": false,
        "model_evaluation": true,
        "human_reference": true
      },
      "freshness": {"cadence": "RELEASE", "max_age_days": 45, "reviewed_at": "2026-09-01T00:00:00Z"}
    },
    {
      "id": "nist-sard",
      "name": "NIST Software Assurance Reference Dataset",
      "publisher": "NIST",
      "independence_group": "nist",
      "trust_tier": "S",
      "source_class": "PUBLIC_DATASET",
      "domains": ["evals", "web", "database", "classification"],
      "canonical_url": "https://samate.nist.gov/SARD/",
      "terms_url": "https://samate.nist.gov/SARD/documentation",
      "access_mode": "BULK",
      "license": {
        "status": "PER_ARTIFACT_REVIEW",
        "expression": "NOASSERTION",
        "attribution_required": true,
        "per_artifact_review": true,
        "note": "SARD aggregates suites from multiple authors. Review the selected suite's notices and license before ingestion or redistribution."
      },
      "allowed_uses": {
        "automated_retrieval": true,
        "normalized_facts": true,
        "full_text_storage": false,
        "embeddings": false,
        "model_training": false,
        "model_evaluation": true,
        "human_reference": true
      },
      "freshness": {"cadence": "QUARTERLY", "max_age_days": 95, "reviewed_at": "2026-09-01T00:00:00Z"}
    },
    {
      "id": "owasp-benchmark",
      "name": "OWASP Benchmark",
      "publisher": "OWASP Foundation",
      "independence_group": "owasp-benchmark",
      "trust_tier": "S",
      "source_class": "PUBLIC_DATASET",
      "domains": ["evals", "web", "classification"],
      "canonical_url": "https://owasp.org/www-project-benchmark/",
      "terms_url": "https://github.com/OWASP-Benchmark/BenchmarkJava/blob/master/LICENSE",
      "access_mode": "REPOSITORY",
      "license": {
        "status": "PROJECT_SPECIFIC",
        "expression": "NOASSERTION",
        "attribution_required": true,
        "per_artifact_review": true,
        "note": "Benchmark language repositories and utilities may use different licenses; pin and review the exact repository and revision."
      },
      "allowed_uses": {
        "automated_retrieval": true,
        "normalized_facts": true,
        "full_text_storage": false,
        "embeddings": false,
        "model_training": false,
        "model_evaluation": true,
        "human_reference": true
      },
      "freshness": {"cadence": "RELEASE", "max_age_days": 45, "reviewed_at": "2026-09-01T00:00:00Z"}
    },
    {
      "id": "nist-ssdf",
      "name": "NIST Secure Software Development Framework",
      "publisher": "NIST",
      "independence_group": "nist",
      "trust_tier": "S",
      "source_class": "CANONICAL_STANDARD",
      "domains": ["supply-chain", "cloud", "containers", "ai-security"],
      "canonical_url": "https://csrc.nist.gov/pubs/sp/800/218/final",
      "terms_url": "https://www.nist.gov/disclaimer",
      "access_mode": "WEB",
      "license": {
        "status": "PROJECT_SPECIFIC",
        "expression": "NOASSERTION",
        "attribution_required": true,
        "per_artifact_review": true,
        "note": "Store normalized mappings and links; review publication and third-party material notices before redistribution."
      },
      "allowed_uses": {
        "automated_retrieval": false,
        "normalized_facts": true,
        "full_text_storage": false,
        "embeddings": false,
        "model_training": false,
        "model_evaluation": false,
        "human_reference": true
      },
      "freshness": {"cadence": "RELEASE", "max_age_days": 95, "reviewed_at": "2026-09-01T00:00:00Z"}
    },
    {
      "id": "nvd",
      "name": "National Vulnerability Database",
      "publisher": "NIST",
      "independence_group": "nist",
      "trust_tier": "S",
      "source_class": "PUBLIC_DATASET",
      "domains": ["vuln-intel", "supply-chain", "cloud", "containers"],